section,container,subtitle,type,title,text
13. Terrain,Terrain And Movement,13.06,text,,"Models can move through different categories of terrain feature as follows: | - Exposed/Light: All models can move horizontally and vertically through exposed and light terrain features. | - Dense: | - INFANTRY/BEASTS/SWARM/MOBILE models can move horizontally through dense terrain features. | - INFANTRY/BEASTS/SWARM models can move vertically through dense terrain features. | - Other models can move horizontally through dense terrain features provided that all sections of that terrain feature that the moving model’s base would move through are 2"" or less in height. Otherwise, the moving model must move vertically to ascend or descend such sections. They cannot move through ceilings and floors while doing so, and they cannot end that move on any surface of that terrain feature that is not on ground level (see below). | MOVING VERTICALLY | Models can move vertically to ascend or descend terrain features. While doing so: | - That model must remain within ½"" horizontally of that terrain feature. | - Add the distance moved vertically up, and the distance moved vertically down, to any other distance that model has moved since its unit began that move. |  | SETTING UP OR ENDING A MOVE | Models can be set up or end a move on the ground level of terrain features. Models can also be set up or end a move on any surface of a terrain featurethat is not on ground level, if all of the following apply: | - That model has one or more of the following keywords: INFANTRY/BEASTS/SWARM/FLY/MONSTER. | - After ending that move, that model is stable and no part of its base overhangs the outer edge of that surface."
13. Terrain,Terrain And Movement,13.06,accordion,13.06.01 - Solid Terrain and Movement,"If a terrain feature has the Solid rule (13.11), as dense terrain features do, a model cannot end a move such that any part of it is through any enclosed part of that terrain feature that is 3"" or less from ground level – not even through small openings such as doors and windows. This ensures that protruding elements of models cannot be used to circumvent the visibility restrictions of the Solid rule."
13. Terrain,Terrain And Movement,13.06,header,,Terrain and Movement
13. Terrain,Terrain And Movement,13.06,image,,-
13. Terrain,Terrain And Movement,13.06,text,,"All sections of the ***dense*** ***terrain feature (A)*** are more than 2"" in height, so the Monster model ***(B)*** cannot move through it and must move around it instead. | The Infantry models ***(C)*** can move through ***dense terrain features***, such as the walls of this ruin."
13. Terrain,Terrain And Movement,13.06,image,,-
13. Terrain,Terrain And Movement,13.06,text,,"1. This Infantry model can move vertically and end its move on the top surface of the ***terrain feature (D)***, as it is stable and no part of its base overhangs the outer edge of that surface. | 2. This Vehicle model cannot move through the ***dense*** ***terrain feature (E)***, but It can move vertically to ascend and descend sections that are more than 2"" in height (provided it does not end that move on top of such sections). | 3. This INFANTRY model is not being moved over or through any ***terrain features***. Its move through the ***terrain area*** shown is therefore unimpeded."
13. Terrain,Terrain And Visibility,13.07,text,,"Terrain can affect visibility, depending on whether the Benefit of Cover, Hidden, Obscuring or Solid rules apply."
13. Terrain,Benefit Of Cover,13.08,text,,"Each time a ranged attack targets a unit, if every model in that unit meets one or more of the following conditions, that unit has the benefit of cover against that attack: | - That model has the INFANTRY/BEASTS/SWARM keyword and is within a terrain area. | - That model is not fully visible to the attacking model due to one or more intervening terrain features and/or one or more intervening obscuring terrain areas (13.10). | Each time a ranged attack targets a unit that has the benefit of coveragainst it, worsen the BS characteristic of that attack by 1."
13. Terrain,Benefit Of Cover,13.08,header,,Benefit of Cover
13. Terrain,Benefit Of Cover,13.08,image,,-
13. Terrain,Benefit Of Cover,13.08,text,,"When Unit ***E*** makes ranged attacks: | • Unit ***A*** is ***fully visible*** to every model in Unit ***E***, so does not have the ***benefit of cover***. | • Not all of the models in unit ***B*** are within a ***terrain area***, so unit ***B*** does not have the ***benefit of cover***. | • All of the models in unit ***C*** are within a ***terrain area***, so unit ***C*** has the ***benefit of cover*** (-1 BS). | • Unit ***D*** is not ***fully visible*** to unit ***E*** due to an intervening ***obscuring*** ***terrain area***, so unit ***D*** has the ***benefit of cover*** (-1 BS)."
13. Terrain,Hidden,13.09,text,,"A model is hidden while all of the following apply to it: | - That model has the INFANTRY/BEASTS/SWARM keyword and is within a terrain area that contains one or more light/dense terrain features. | - That model’s unit did not make one or more ranged attacks during this turn or during the previous turn. | While a model is hidden, it can only be visible to enemy models that are within its detection range. Unless otherwise stated, a model’s detection range is 15""."
13. Terrain,Hidden,13.09,accordion,13.09.01 - Hidden and the First Turn,"During the first turn, conditions that require something not to have happened during the previous turn are true. For the Hidden rule, this means that during the first turn a unit has not made ranged attacks during the previous turn."
13. Terrain,Obscuring,13.10,text,,"Terrain areas containing one or more light or dense terrain features are obscuring terrain areas. If every line of sight drawn between two models crosses one or more obscuring terrain areas (excluding obscuring terrain areas that one or both of those models are within), those two models are not visible to each other."
13. Terrain,Obscuring,13.10,header,,Hidden and Obscuring
13. Terrain,Obscuring,13.10,image,,-
13. Terrain,Obscuring,13.10,text,,"• There is an ***obscuring*** ***terrain area*** between all models in units ***A*** and ***D***, so none of them are ***visible*** to each other. | • All models in units ***B*** and ***C*** are within the ***terrain area*** and are Infantry, so are ***hidden***. However, unit ***D***’s models are within the 15"" ***detection range*** of unit ***B***’s models (but not unit ***C***’s), so unit ***B***’s models are ***visible*** to unit ***D***’s. Unit ***D***’s models are also ***visible*** to the models in units ***B*** and ***C***, since they are not within a ***terrain area***."
13. Terrain,Solid,13.11,text,,"Dense terrain features have the Solid rule. Line of sight cannot be drawn across any enclosed gap in the surface of such a terrain feature that is 3"" or less from ground level. | Designer’s Note: This rule ensures that models are not visible while sheltering in ground-level terrain, irrespective of small openings such as doors, windows or bullet holes, or because of small gaps between adjacent terrain features. 3"" is the height of the first floor of many terrain features, but some missions may adjust the height at which this rule takes effect."
13. Terrain,Solid,13.11,accordion,13.11.01 - Gone to Ground,"Hidden models that are within Solid terrain features gain an extra benefit while they have gone to ground. | A model has gone to ground while all of the following apply: | - That model is hidden. | - That model is not fully visible to the attacking model due to one or more intervening Solid terrain features. | - That model’s unit did not make one or more ranged attacks during this turn or during the previous turn. | While a model has gone to ground, subtract 3"" from that model’s detection range. | Designer’s Note: Units that made ranged attacks in the current or previous turn cannot go to ground, regardless of any abilities that allow them to shoot and remain hidden."
13. Terrain,Solid,13.11,header,,Solid
13. Terrain,Solid,13.11,image,,-
13. Terrain,Solid,13.11,text,,"Units ***A*** and ***B*** are not ***visible*** to each other, because even though there is a window in this ***dense*** ***terrain feature***, it has the ***Solid*** rule, so ***line of sight*** cannot be drawn through such enclosed gaps that are 3"" or less from ground level. | Units ***A*** and ***C*** are ***visible*** to each other, because even though this ***dense*** ***terrain feature*** has the ***Solid*** rule, ***line of sight*** can be drawn normally through enclosed gaps that are more than 3"" from ground level."
14. Objectives,Objectives,14.00,text,,"Objectives represent critical locations that both sides are attempting to secure, and many missions require your forces to take control of them to achieve victory. This section describes how to do so with your models."
14. Objectives,Terrain Objectives,14.01,text,,"If a mission uses objectives, it will state where they are located on the battlefield. Typically, your mission will have a deployment map showing several points where objectives should be placed. The location of each point should coincide with a terrain area (13.01); that terrain area is the objective, and is called a terrain objective. | When measuring distances to and from an objective, measure to and from the closest part of it."
14. Objectives,Terrain Objectives,14.01,accordion,14.01.01 - Objectives Not Within A Terrain Area,"If the location point of an objective does not coincide with a terrain area, you must denote the location of that objective with a flat, circular marker, 40 mm in diameter, centred on that point – this is called anobjective marker. Models can move through objective markers and they can end a move on top of objective markers. | A model is within range of an objective marker while it is within 3"" horizontally and 5"" vertically of that objective marker. When measuring distances to and from an objective marker, measure to and from the closest part of it."
14. Objectives,Level Of Control,14.02,text,,"At the start of the battle, no objective on the battlefield is controlled by either player. To gain control of an objective, a player will need one or more models with an OC characteristic of 1 or more within range of it. A model is within range of a terrain objective while it is within that terrain area. | At the end of each phase and turn, to determine a player’s level of control over an objective, add together the OC characteristics of all the models in that player’s army that are within range of that objective: | - The player who has the highest level of control over that objective controls that objective. | - If both players have the same level of control over that objective, unless that objective is secured (14.03), that objective is not controlled by either player. | While one or more units from a player’s army are within range of an objective that player controls, for each of those units that contains one or more models with an OC characteristic of 1 or more, that unit is said to be controlling that objective."
14. Objectives,Secured Objectives,14.03,text,,"Some rules allow an objective to be secured by a player’s army. When an objective is secured by a player’s army, that objective remains under their control – even once they no longer have any units within range of it – until their opponent’s level of control over that objective is greater than theirs at the end of a phase."
14. Objectives,Secured Objectives,14.03,header,,Controlling a Terrain Objective
14. Objectives,Secured Objectives,14.03,image,,-
14. Objectives,Secured Objectives,14.03,text,,"Vehicle ***A*** has an ***OC*** characteristic of 3, and it is within the ***terrain area***. | Vehicle ***B*** has an ***OC*** characteristic of 2, and it is wholly within the ***terrain area***. | The models in unit ***C*** each have an ***OC*** characteristic of 1. Six of its models are within the ***terrain area***. | Unit ***D*** is currently ***battle-shocked***, so the ***OC*** characteristic of all of its models is ‘-’. | Both players add together the ***OC*** characteristics of all their models that are within the ***terrain area***. The BLUE player’s ***level of control*** is 5, and the RED player’s ***level of control*** is 6. The RED player therefore controls the ***objective***."
15. Stratagems,Stratagems,15.00,text,,"Stratagems can be used by spending Command Points, to create epic moments of tactical brilliance or peerless martial might. They are used when a player deems that a critical point in the battle is reached, where extra combat prowess or fleeting but powerful effects are required to tip the balance in their favour."
15. Stratagems,Using Stratagems,15.01,text,,"During the battle, both players can use stratagems. Each stratagem states: | - How many CP it costs to use. | - WHEN: When it can be used. | - TARGET: Which units it can target. | - EFFECT: What the effects of using that stratagem are. | - RESTRICTIONS: Any additional restrictions that apply. | Each player can use the same stratagem multiple times during the battle, but the following restrictions apply: | - Each player cannot use the same stratagem more than once in the same phase. | - Unless otherwise stated, each player cannot target the same unit with more than one stratagem in the same phase. | Each time you use a stratagem, resolve the following sequence: | 1. Select targets as described in that stratagem. | 2. Reduce your CP total by the CP cost listed in that stratagem. If that stratagem contains a section that carries an additional CP cost (e.g. +1CP), you can only use that additional section if you increase the CP cost of that stratagem by the amount shown. If you do not have enough CP remaining, you cannot use that stratagem. | 3. Resolve the effects of that stratagem. | CORE STRATAGEMS | All players can use core stratagems (see overleaf). Additional stratagems can be found in Codexes and other publications."
15. Stratagems,Using Stratagems,15.01,accordion,15.01.01 - Modifying CP Cost,"Some rules modify the cost of using certain stratagems. In such cases, the following points apply: | - The CP cost of a stratagem use can never be modified below 0CP. | - If a rule modifies the CP cost of a stratagem when you use it, but does not specify a duration for that modifier, that modifier only applies to that usage of that stratagem."
15. Stratagems,Using Stratagems,15.01,accordion,15.01.02 - Affected By A Stratagem,"If a unit is selected as the target of a stratagem, it is said to be affected by that stratagem."
15. Stratagems,Using Stratagems,15.01,accordion,15.01.03 - Stratagem Definitions,"- Your Opponent’s Stratagems: stratagems that your opponent uses are sometimes referred to as your opponent’s stratagems. | - Your Stratagems: stratagems that you use are sometimes referred to as your stratagems. | - Your Unit (in Stratagems): The term ‘your unit(s)’ in the Effect section of stratagems always relates to the unit(s) selected in the Target section of that stratagem, and never refers to any other units from your army."
16. Actions,Actions,16.00,text,,"Actions represent vital battlefield tasks your forces must carry out, from searching for missing archeotech to completing a blasphemous ritual."
16. Actions,Performing Actions,16.01,text,,"Some rules allow units to perform actions. Each action states: | ▪ STARTS: When it is started. | ▪ UNITS: Which friendly units can perform it. | ▪ USE LIMIT: How many times friendly units can start it. | ▪ COMPLETES: When it completes. | ▪ EFFECT: What the effects of completing it are. | ▪ Any additional restrictions that may apply. | STARTING AN ACTION | A unit iseligible to start an action unless one or more of the following apply to that unit: | ▪ It is not on the battlefield. | ▪ It is an AIRCRAFT/FORTIFICATION unit. | ▪ It is battle-shocked. | ▪ It has an OC characteristic of 0 or ‘-’. | ▪ It is engaged (unless it is a TITANIC unit). | ▪ It made an advance orfall-back move this turn. | ▪ It started another action this turn. | If a unit starts an action, until the end of the turn: | ▪ It is not eligible to shoot (excluding TITANIC units). | ▪ It is not eligible to declare a charge. | COMPLETING AN ACTION | If a unit performing an action makes a move (excluding pile-in and consolidation moves) or leaves the battlefield, that unit does not complete that action. Otherwise, when an action is completed, its ‘Effect’ section is triggered."
17. Monsters And Vehicles,Monsters And Vehicles,17.00,text,,"Due to their imposing bulk and implacable nature, Monsters and Vehicles function differently on the battlefield. This section details the additional rules required to use these units in your games."
17. Monsters And Vehicles,Moving Monsters And Vehicles,17.01,text,,"Each time you make a normal or advance move with a unit, MONSTER/VEHICLE models in that unit can be moved through friendly and enemy models (excluding other MONSTER/VEHICLE models)."
17. Monsters And Vehicles,Frame,17.02,text,,"Some models do not have a base; many of these are MONSTER/VEHICLE models. Such models have the FRAME keyword, as do some other large models. Whenever a rule refers to a model’s position in relation to anything else on the battlefield (e.g. when measuring distances), if that model has the FRAME keyword, unless otherwise stated, measure to and from the closest point on that model (so not necessarily from its base, if it has one). | When rotating a FRAME model as part of a move, if that model does not have a base, turn it any amount around its central axis, while keeping it upright."
17. Monsters And Vehicles,Shooting At Engaged Monsters And Vehicles,17.03,text,,"In your Shooting phase, enemy MONSTER/VEHICLE units that are engaged can be selected as targets of ranged attacks (excluding attacks made with [BLAST] weapons). | Each time a model makes a ranged attack that targets such a unit, subtract 1 from the hit roll (excluding attacks made with [CLOSE‑QUARTERS] weapons by models in a unit engaged with the target)."
17. Monsters And Vehicles,Shooting At Engaged Monsters And Vehicles,17.03,accordion,17.03.01 - Shooting While Engaged With Monsters/Vehicles,"A unit that is engaged with an enemy MONSTER/VEHICLE unit is still not eligible to shoot, and so cannot make ranged attacks against that MONSTER/VEHICLE unit, unless that unit is eligible to shoot while engaged (e.g. because it is using close‑quarters shooting)."
17. Monsters And Vehicles,Shooting At Engaged Monsters And Vehicles,17.03,header,,Engaged Monsters/Vehicles – Shooting
17. Monsters And Vehicles,Shooting At Engaged Monsters And Vehicles,17.03,image,,-
17. Monsters And Vehicles,Shooting At Engaged Monsters And Vehicles,17.03,text,,"The Vehicle can shoot at Infantry unit ***A*** using ***close-quarters shooting***. While resolving those attacks, subtract 1 from ***hit rolls*** (excluding attacks made with [Close‑quarters] weapons). | Infantry unit ***A*** can shoot at the Vehicle using ***normal shooting***. While resolving those attacks, subtract 1 from ***hit rolls***. As the Vehicle is ***engaged***, [Blast] weapons cannot target it, but can target other ***unengaged*** units. | The Vehicle can shoot at Infantry unit ***B*** using ***close-quarters shooting***. While resolving those attacks, subtract 1 from ***hit rolls***. As the INFANTRY unit is ***engaged***, [Blast] weapons cannot target it, but can target other ***unengaged*** units. | Infantry unit ***B*** is ***engaged***, but can shoot at the VEHICLE using ***close-quarters shooting***. While doing so, it can only make attacks with its [CLOSE-QUARTERS] weapons and can only target the VEHICLE it is ***engaged*** with."
18. Transports,Transports,18.00,text,,"TRANSPORT models can carry passengers across the battlefield. This section explains how to use such models in your battles, and how units can embark within and disembark from them."
18. Transports,Transport Capacity,18.01,text,,"TRANSPORT models have a transport capacity listed on their datasheet. This determines the type and maximum number of friendly models that are eligible to embark within them. More than one unit can be embarked within the same TRANSPORT model at the same time, provided it has sufficient transport capacity. | Before the battle, in the Declare Battle Formations step, your units can start embarked within any friendly TRANSPORT model that has sufficient transport capacity remaining for the whole unit."
18. Transports,Embarking,18.02,text,,"Once the first battle round has started, a friendly unit can embark within a friendly TRANSPORT model after making a normal, advance or fall-back move, if all of the following conditions apply: | - Each model in that unit is within 3"" of that TRANSPORT. | - That unit was not set up on the battlefield this turn. | - That unit is eligible to embark within that TRANSPORT, as described on that TRANSPORT’s datasheet. | - That TRANSPORT has sufficient remaining transport capacity for each model in that unit. | When a unit embarks, the active player removes that unit from the battlefield and places it to one side – it is now embarked within that TRANSPORT and is not on the battlefield."
18. Transports,Embarking,18.02,accordion,18.02.01 - Able To Embark,"A unit is able to embark if it meets all of the conditions in Embarking (18.02). Note that one or more of these conditions may be modified by other rules, in which case a unit must satisfy those modified conditions in addition to any unmodified conditions to be able to embark."
18. Transports,Disembarking,18.03,text,,"In the active player’s Movement phase, each friendly unit embarked within a TRANSPORT model can disembark from it by making a disembark move (18.04). | If a TRANSPORT model is destroyed, before removing it from the battlefield, the active player must make an emergency disembark move (18.05) with each unit embarked within it."
19. Attached Units,Attached Units,19.00,text,,"The heroes of your army rarely fight alone. Instead, they typically lead bands of warriors, forming an attached unit that acts as a single entity. This section explains how to form attached units and how they function on the battlefield."
19. Attached Units,Forming Attached Units,19.01,text,,"Some units have the Leader or Support ability listed on their datasheet (24.22 & 24.34). Such units are known as leader units and support units respectively. Both of these abilities allow such units to lead other friendly units (known as bodyguard units) to form attached units. An attached unit is a single unit for all rules purposes. Leader and support units can only lead specific bodyguard units, as listed in the Warhammer 40,000 app"
19. Attached Units,Forming Attached Units,19.01,accordion,19.01.01 - Attached Units After Their Bodyguard Unit is Destroyed,"Some units have rules stating that when the bodyguard unit in an attached unit is destroyed, leader/support units that were attached to them become separate units with their original starting strengths. | When the bodyguard unit in an attached unit affected by such a rule is destroyed, all of those leader/support units remain a single unit for all rules purposes."
19. Attached Units,Attacking Attached Units,19.02,text,,"Each time an attack targets an attached unit, if that unit contains one or more bodyguard models, use the highest T characteristic of the bodyguard models in that unit while resolving that attack, even if a leader/support unit in that attached unit has a different T characteristic. If that unit only contains leader/support models, use the highest T characteristic of those models while resolving that attack instead. | Rules that are triggered when a unit is destroyed are only triggered when the last model that started the battle in an attached unit is destroyed."
19. Attached Units,Keywords In Attached Units,19.03,text,,"An attached unit has all of the keywords of all of its component units. As such, an attached unit is affected by any rule that applies to units with any of those keywords. Note that models in an attached unit do not gain the keywords of other models in that unit that they do not already have. Remember that attacks target units, not models. | Example: An attached unit contains a leader model with the PSYKER keyword. While that model is part of that unit, that unit has the PSYKER keyword, even if the bodyguard models do not have that keyword. If that unit is attacked by a weapon with the [ANTI‑PSYKER 4+] ability, any unmodified wound roll of 4+ made against that unit is a critical wound, even if the attack itself is not allocated to that leader model."
