section,container,subtitle,type,title,text
02. Datasheets,Profiles,02.02,accordion,02.02.01 - Modifiers,"WHAT ARE MODIFIERS? | Many rules in the game modify a value, characteristic or roll elsewhere in the game. A rule that does so is known as a modifier. A value that has been changed is a modified rule (e.g. modified characteristic, modified roll, modified value, etc). | One of the most common ways for modifiers to be presented is as +1 or -1 to a characteristic, roll or value. | If the rule has +1 to a characteristic, it improves it by the value after the '+' symbol. | Example: 'This weapon has +1 AP' would improve an AP characteristic of -2 to -3. | If the rule has -1 to a characteristic, it worsens it by the value after the '-' symbol. | Example: 'This unit has -1 Sv' would worsen a Sv characteristic of 3+ to 4+. | APPLYING MODIFIERS | This section presents the various ways rules may be modified. All modifiers are cumulative. | When a value is modified (e.g. characteristic, dice roll, distance), do so in the following order. | 1. If a rule instructs you to change or replace one value with a specified value, you must first change the relevant value to the new value. | Note that rules that modify a characteristic in this step to a new value of ‘0’, ‘-’ or ‘*’ cannot be modified by other rules (in such cases, skip steps 2-5). | 2. Apply multiplication modifiers. | 3. Apply addition modifiers. | 4. Apply division modifiers. | 5. Apply subtraction modifiers. | 6. Round any fractions up after applying all modifiers. | WHEN MODIFYING CHARACTERISTICS | When modifying characteristics, the following points also apply: | - Characteristics of ‘-’, ‘*’ and ‘N/A’ can never be modified. | - Rules that modify a model’s WS and/or BS characteristic modify the WS and/or BS characteristic of every weapon equipped by that model. | - After all modifiers have been applied: | - M cannot be less than 1"". | - T cannot be less than 1. | - Sv cannot be 1+ or better. | - InSv cannot be 1+ or better. | - Ld cannot be 4+ (or better) or 9+ (or worse). | - OC cannot be less than 0 or '-'. | - Range characteristics cannot be less than 1"". | - A cannot be less than 1. | - WS cannot be 1+ (or better) or 7+ (or worse). | - BS cannot be 1+ (or better) or 7+ (or worse). | - S cannot be less than 1. | - AP cannot be worse than 0. | - D cannot be less than 1. | When these terms are used in rules, the affected characteristics are being modified, and the following points apply: | - Improving WS, BS, Sv and Ld: When improving a WS, BS, Sv or Ld characteristic, subtract the appropriate amount from the number before the plus sign, e.g. improving a WS of 3+ by 1 would result in a WS of 2+. | - Worsening WS, BS, Sv and Ld: When worsening a WS, BS, Sv or Ld characteristic, add the appropriate amount to the number before the plus sign, e.g. worsening a WS of 3+ by 1 would result in a WS of 4+. | - Improving AP: When improving an Armour Penetration characteristic, subtract the appropriate amount from the characteristic, e.g. improving an AP of -1 by 1 would result in an AP of -2; improving an AP of 0 by 1 would result in an AP of -1. | - Reducing or Worsening AP: When reducing or worsening an Armour Penetration characteristic, add the appropriate amount to the characteristic, to a maximum of 0, e.g. reducing/worsening an AP of -1 by 1 would result in an AP of 0; reducing /worsening an AP of 0 by 1 would result in an AP of 0. | - Improving or Worsening Other Characteristics: When instructed to improve/worsen a characteristic that does not include a ‘+’ or ‘-’ symbol, add/subtract the specified amount to/from that characteristic (e.g. to improve a S by 1, add 1 to it). | WHEN MODIFYING DICE ROLLS | When modifying dice rolls, the following points also apply: | - Modifiers are applied after any re-rolls of that dice roll. | - Rules that refer to the value of an ‘unmodified’ dice roll are referring to the dice result after any re-rolls, but before modifiers. | - A dice result can be modified above its maximum possible value (for example, a D6 roll can be modified above 6). | - A result that would be less than 1 is changed to a result of 1. | - Hit rolls and wound rolls can never be modified by more than -1 or +1. After all the cumulative modifiers to such a roll have been calculated, if the total modifier would be: | - -2 or worse, it is changed to -1. | - +2 or better, it is changed to +1. | - Charge rolls cannot be greater than 12. After all the cumulative modifiers to a charge roll have been calculated, if the result would be 13 or more, it is changed to 12. | OTHER MODIFIED RULES | The following rules apply to various rules and effects found throughout the game. | - Detection range and Lone Operative cannot be better than 9"" or worse than 30"". | A stratagem cannot have its CP increased by more than 1 or reduced to below 0 after all modifiers have been applied."
02. Datasheets,Profiles,02.02,accordion,02.02.02 - Ignore Modifiers,"Some rules enable a player, weapon, model or unit to ignore modifiers. When using such rules, the following points apply: | Unless otherwise stated, that rule allows you to ignore modifiers to the unit's rolls and the unit's profile and weapon characteristics. | When a rule states you can ignore modifiers to a stated roll or characteristic, you can choose to ignore all of those modifiers, or only some of them. For example, you can still choose to apply positive/beneficial modifiers while ignoring negative/detrimental modifiers. | Example: Your unit can ignore characteristic modifiers and is under the effect of +2"" M and -2"" M. You can choose to ignore the -2"" M, meaning that unit's M characteristic will only be modified by the +2"" M. | Example: Your unit's ranged attacks can ignore roll modifiers and are under the effect of +1 to hit rolls and -1 to hit rolls. You can choose to ignore the -1 to hit rolls, meaning those attacks will only be affected by the +1 to hit rolls."
02. Datasheets,Profiles,02.02,accordion,02.02.03 - Random Characteristics,"Random Movement: When a unit with a random M characteristic is selected to move, determine the entire unit’s move distance by rolling the indicated number of dice. | Random Attacks: If a weapon has a random A characteristic, that characteristic is determined when generating attacks for that weapon at the Resolve Attacks step (04.03). If several weapons with random A characteristics are making identical attacks, generate the attacks for each of those weapons individually, and group them all together. | Random Damage: If a weapon has a random D characteristic, then each time an attack made with it inflicts damage, the controlling player determines that weapon's characteristic when the opposing player has selected a model in the target unit to allocate that attack to. | When determining a random D characteristic, the dice roll made is called a damage roll. | Where a D characteristic includes an operator (e.g. a ‘+’, as in D6+1), the value after the operator is part of that D characteristic – it is not a modifier. | Other Random Characteristics: For all other characteristics, roll to determine the value on an individual, per-model or per-weapon basis each time that characteristic is required."
02. Datasheets,Profiles,02.02,accordion,02.02.04 - Healing Or Regaining Lost Wounds,"When a unit heals or regains a number of wounds, it regains up to that number of lost wounds. For each wound healed or regained, consult the following: | - If that unit has one or more models that does not have its full wounds remaining, select one of those models; that model regains one lost wound. | - If all models in that unit have their starting number of wounds, but one or more models from that unit are currently destroyed, revive one of those destroyed models, with one wound remaining. | This cannot cause a model to have more wounds remaining than it started the battle with. | If a rule states that a model heals or regains a number of wounds, only that model can regain wounds up to its starting number of wounds. Any excess regained wounds are lost and do not cause a destroyed model from that unit to revive."
02. Datasheets,Profiles,02.02,accordion,02.02.05 - Full Wounds Remaining,A model has its full wounds remaining if it has the same number of wounds remaining as its W characteristic.
02. Datasheets,Profiles,02.02,accordion,02.02.06 - Characteristic Modifiers & Modified Characteristics,See Modifiers (02.02.01).
02. Datasheets,Abilities,02.03,text,,Many units have abilities that may apply during the game. These will be described here.
02. Datasheets,Abilities,02.03,accordion,02.03.01 - Rules With Multiple Conditions And Effects,"Some rules have multiple conditions, with the second, more specific condition conferring an improved rule, either instead of the first condition’s rule or as well as it. Such rules require both the first condition and the second condition to be satisfied for the improved rule to apply. | For example, an ability reads: ‘This unit's ranged attacks that target the closest eligible target can: | - Re-roll hit rolls of 1. | - Or:If that target is within range of an objective your opponent controls, re-roll hit rolls.’ | In order for those attacks to re-roll hit rolls, that target must be both the closest eligible target and within range of an objective your opponent controls."
02. Datasheets,Weapons,02.04,text,,"Weapons have the following characteristics: | Range (R): How far ranged weapons can shoot. Weapons with an Rcharacteristic of ‘Melee’ are melee weapons. | Attacks (A): How many attack dice are used each time that weapon is used. | Ballistic Skill (BS): Presented as a dice result (e.g. 4+), this shows how accurate the bearer is when shooting with the relevant ranged weapon. | Weapon Skill (WS): Presented as a dice result (e.g. 4+), this reflects the bearer’s skill in wielding the relevant melee weapon. | Strength (S): The higher a weapon’s S characteristic, the more likely it is to wound a foe. | Armour Penetration (AP): Presented as a modifier to a dice roll (e.g. -1). The larger the modifier, the better the weapon is at cutting through the target’s defences. | Damage (D): The amount of damage inflicted by an attack."
02. Datasheets,Weapons,02.04,accordion,02.04.01 - Weapons With No Strength,"If a weapon has no S characteristic (because it is '-', or for any other reason) and a rule interacts with that weapon's S, that weapon has S 1 for that interaction."
02. Datasheets,Keywords,02.05,text,,"Datasheets have a list of keywords, separated into faction keywords and other keywords. The former are used when deciding which models to include in your army, but otherwise both are functionally the same. Keywords appear in full capitals, in KEYWORD BOLD."
02. Datasheets,Keywords,02.05,accordion,02.05.01 - Using Keywords & Mixed Keywords in Units,"When using keywords, the following points apply: | - A unit has all the keywords of all models in that unit. A model only has its own keywords. | - If a rule specifies that it applies to a unit with a keyword, it applies to a unit which includes one or more models with that keyword. | - If a rule specifies that it applies to a model with a keyword, it only applies to a model with that keyword. | - If a rule specifies that it applies to ‘non-Keyword’ models/units, it only applies to models/units that do not have that keyword. For example, if a rule applies to non-Vehicle units, it only applies to units that do not have the Vehicle keyword. | - Some units can contain models that have different keywords. While this is the case, such a unit is considered to have all of the keywords of all of its models, and so is affected by any rule that applies to units with any of those keywords. Remember that attacks are made against units, not models. | - If a rule only applies to models with a specific keyword, then it instead only applies to models in such a unit that have the correct keyword. | - A rule with a comma-separated list of keywords, or a series of keywords separated by slashes ('/'), or two keywords separated by the word ‘or’ (e.g. ‘an Immortals, Deathmarks or Lychguard unit’) refers to a model/unit that has any one of those keywords. | - A rule with multiple adjacent keywords (e.g. ‘an Aeldari Guardians unit’) only refers to a model/unit that has all of those keywords. | - Some older rules use keywords without specifying model or unit: for example, MONSTER/VEHICLE or TRANSPORT. These rules refer to units with those keywords. | - Singular and plural instances of the same keyword function in the same way."
02. Datasheets,Unit Composition And Other Rules,02.06,text,,"This section details the number and types of models in the unit. Each of those models will have one set of default wargear, which will be listed here. It may also list other rules, such as which units a leader unit can join or which units can embark within a TRANSPORT."
02. Datasheets,Unit Composition And Other Rules,02.06,accordion,02.06.01 - Bearer,"The bearer of a weapon, enhancement or item of wargear is the model equipped with it."
02. Datasheets,Unit Composition And Other Rules,02.06,accordion,02.06.02 - Unit's Equipment,"When a rule refers to a unit’s equipment, it refers to all of the wargear equipped by models in that unit."
02. Datasheets,Wargear options,02.07,text,,"Some datasheets have a list of wargear options. When you include such a unit in your army, you can use these options to alter the weapons and other wargear its models have."
Introduction,Introduction,,text,,"Chapter Approved battles give you and an opponent a way to play exciting, thematic and balanced games of Warhammer 40,000. In these battles, you will clash to earn Victory Points (VP) by accomplishing a variety of goals. Whichever player gains the most VP wins the battle."
03. Moving,Moving,03.00,text,,"During a battle, you will move your models by picking them up and changing their position on the battlefield. The principles of movement are explained here."
03. Moving,Moving Units,03.01,text,,"There are several types of move a unit can make. Each one defines which units are eligible to make it, what its maximum distance or set-up distance is, and any conditions that must be met. | Each time you move a unit, you can move one or more of its models, one at a time, by moving it in a straight line and/or rotating it, as many times as you want to. | Each time you move a model, unless otherwise stated: | - It can be moved through friendly models. | - It can be moved through any space its base can fit through. | - Its base cannot be moved through enemy models. | - Its base cannot cross the edge of the battlefield. | - All stated ‘While Moving’ conditions must be met. | MOVING A MODEL IN A STRAIGHT LINE | Each time you move a model in a straight line, move it horizontally across the battlefield. Measure from the same point on its base at the start and end of that move, and add that distance to any other distance it has moved since its unit began that move. The distance moved cannot be greater than the maximum distance of that move type. | ROTATING A MODEL | Each time you rotate a model, turn it any amount around the centre of its base, while keeping it upright. Note that rotating a model does not count towards the distance it has moved. | ENDING A MOVE | After you have finished setting up all of the models in a unit and/or moving all of the models in a unit that you want to move, check that all of the following apply: | - If that unit is on the battlefield, it is in coherency (03.03). | - No models in that unit are on another model or partway through a surface of a terrain feature (e.g. a wall or ceiling). | - All stated ‘After Moving’ conditions are met. | If one or more of the above conditions are not met, that unit cannot make that move and its models are returned to their positions at the start of that move. Otherwise, after resolving any additional rules stated in the ‘After Moving’ section of that move type, that move ends."
03. Moving,Moving Units,03.01,accordion,03.01.01 - Different Move Characteristics,"When making a move type whose maximum distance uses the unit's M characteristic, if different models in the moving unit have different M characteristics, the maximum distance for that move will be different for those models. | Example: If a unit makes a normal move and all models in that unit have an M characteristic of 6"" except for one model with an M characteristic of 9"", that model’s maximum distance for that move is 9"", while the other models’ maximum distance is 6"". While that unit is making that move, all other restrictions must be met."
03. Moving,Moving Units,03.01,header,,Moving in a straight line
03. Moving,Moving Units,03.01,accordion,03.01.02 - Moving Over Or Through Models,"Some models have a rule that enables them to ‘move over models’, 'move through models' or ‘move over models as if they were not there’ when making a move. When moving a model with such a rule, it can make its move through enemy models, but must follow all other restrictions of the move they are making."
03. Moving,Moving Units,03.01,image,,-
03. Moving,Moving Units,03.01,accordion,03.01.03 - Random Movement,See Random Characteristics (02.02.03)
03. Moving,Moving Units,03.01,text,,"Both models shown here can move a ***maximum distance*** of 6"". They both move 3"" in a straight line, then 3"" in another straight line, for a total movement of 6""."
03. Moving,Moving Units,03.01,accordion,03.01.04 - When Moving Up To,"Some rules allow a unit to make a stated of up to X"". That stated distance is the maximum distance for that move."
03. Moving,Moving Units,03.01,header,,Rotating
03. Moving,Moving Units,03.01,image,,-
03. Moving,Moving Units,03.01,text,,"1. This model can move a ***maximum distance*** of 12"". It moves in a series of straight lines and rotations, as follows: | ***A)*** Moves 6"" in a straight line | ***B)*** Rotates | ***C)*** Moves 6"" in a straight line | ***D)*** Rotates | This model has moved a total of 12"". | 2. Models without a base are rotated around their central axis (see Frame, 17.02)."
03. Moving,Set Up,03.02,text,,"Before your units can move and make attacks, they will first need to be set up on the battlefield. This most commonly happens when deploying your army for battle, but can happen for other reasons as well. | Whenever a rule instructs you to set up a unit, place its models on the battlefield so that: | - That unit is in coherency (03.03). | - That unit is unengaged (03.04). | - All other requirements and restrictions are met. | If you cannot set up all of the models in a unit, remove that unit from the battlefield and return it to its original position (e.g. in strategic reserves or embarked within a TRANSPORT)"
03. Moving,Set Up,03.02,accordion,03.02.01 - If You Cannot Set Up a Unit,"While having to set up a unit as the result of a move type, if you have to return a unit’s models to their previous positions because it is not possible to set them all up, that unit has not been selected to move. This means it can be selected to move later, so could either attempt another set up or remain stationary (09.04)."
03. Moving,Set Up,03.02,accordion,03.02.02 - Setting Up Large Models,"If a model cannot meet all of its set up restrictions because it is too large, consult the relevant section below: | During Deployment: If a model is so large that its base cannot physically be set up wholly within your deployment zone, it must be set up so that it is touching your battlefield edge. During a turn in which such a large model is set up on the battlefield, that model’s unit cannot do any of the following: | - Make a normal/advance/fall-back/charge move. | - Make any attacks with ranged weapons. | Some large models, typically Aircraft, have wings and other parts that extend significantly beyond their base. Such models can overhang a deployment zone if it is not possible to set them up otherwise, but when setting them up, their base must still be wholly within that deployment zone. | From Strategic Reserves: If a model is so large that its base cannot physically be set up wholly within the distance required of the battlefield edge, it must be set up so that it is touching a battlefield edge. During a turn in which such a large model is set up on the battlefield, that model’s unit cannot do any of the following: | - normal/advance/fall-back/charge move. | - Make any attacks with ranged weapons. | Some large models, typically Aircraft, have wings and other parts that extend significantly beyond their base. Such models can overhang a battlefield edge if it is not possible to set them up otherwise, but when setting them up, they must still be more than 8"" away from all enemy units. | Disembarking from a Transport: When a unit disembarks from a Transport, it must be set up wholly within 3"" of that model. If a disembarking model is so large that it is not possible to set it up wholly within 3"" (typically because it is itself larger than 3"" in all directions), set that model up with its base within 1"" of that Transport’s base (or hull), and not engaged with any enemy units."
03. Moving,Set Up,03.02,accordion,03.02.03 - Redeployments,"When a player uses a rule that lets them redeploy their unit, they remove that unit from the battlefield, then deploy it again using all the normal rules (e.g. if all the models in the redeploying unit have the Infiltrators ability, that unit can be set up using that ability)."
03. Moving,Coherency,03.03,text,,"A unit that contains more than one model must be set up and end any kind of move in coherency. A unit is in coherency while both of the following apply to every model in that unit: | - Within 2"" horizontally and 5"" vertically of at least one other model in that unit. | - Within 9"" horizontally and 5"" vertically of every other modelin that unit. | REGAINING COHERENCY | In the End of Turn step of each player’s turn, if one or more units on the battlefield are not in coherency, those units’ controlling players must remove models from them, one at a time, until they are in coherency again. Models removed in this way are destroyed, but they do not trigger rules that apply when a model is destroyed."
03. Moving,Coherency,03.03,accordion,03.03.01 - What Is Coherency,"Coherency prevents models in the same unit from becoming too separated from each other while on the battlefield, ensuring they are set up and end every kind of move as a single group."
03. Moving,Engagement,03.04,text,,"A model’s engagement range is the area of the battlefield within 2"" horizontally and 5"" vertically of it. | - While a friendly model is within engagement range of one or more enemy models, those models – and the units they belong to – are engaged with each other. | - While a unit contains no engaged models, that unit is unengaged."
03. Moving,Engagement,03.04,accordion,03.04.01 - What Is Engagement,"While opposing models are within each other’s engagement range, they are able to fight in vicious melee, so unless they are seeking to make melee attacks, models should keep out of their foes’ reach."
03. Moving,Engagement,03.04,header,,Coherency
03. Moving,Engagement,03.04,image,,-
03. Moving,Engagement,03.04,text,,"Every model in this unit is within 2"" of at least one other model in its unit, and every model is within 9"" of every other model in its unit. This unit is therefore in ***coherency***."
03. Moving,Engagement,03.04,header,,Engagement
03. Moving,Engagement,03.04,image,,-
03. Moving,Engagement,03.04,text,,"These two units have at least one model within 2"" of the opposing unit, and are therefore ***engaged*** with each other."
Doubles Event Companion,INTRODUCTION,,text,,"This companion is used alongside the Warhammer Event Companion to create the best experiences for all hobbyists playing a Doubles event. A Doubles event is one in which players compete in teams of two, with a team’s armies fighting as a single force against another team’s armies. | The recommendations are presented as follows: | Warhammer Doubles Event Mission Sequence: Adjustments to the steps players would normally follow to generate a mission and prepare the battlefield. | Warhammer Doubles Event Terminology: A description of the terminology used in Doubles events. | Warhammer Doubles Event Core Rules Changes: Adjustments to the Core Rules to allow battles where players can fight alongside a teammate. | For all other recommendations – for example, regarding errata, FAQs and pairing and ranking methodology – please refer to the Warhammer Event Companion. Note that pairing and ranking in a Doubles event is done by team, rather than by player."
Doubles Event Companion,WARHAMMER DOUBLES EVENT MISSION SEQUENCE,,text,,"Before attending a Warhammer Doubles Event, each team – consisting of two players – completes the following step:"
