section,container,subtitle,type,title,text
04. Making Attacks,Resolve Attacks,04.03,accordion,04.03.04 - Shot,"When all of the attacks made with a ranged weapon have been resolved, that weapon has shot. | When all of a model’s ranged weapons have shot, that model has shot. | When all models in a unit that are making ranged attacks have resolved all of those attacks, that unit has shot. | If a unit was selected to shoot and none of the models in it make any attacks, it has not shot."
04. Making Attacks,Resolve Attacks,04.03,accordion,04.03.05 - Fought,"When all of the attacks made with a melee weapon have been resolved, that weapon has fought. | When all of a model’s selected melee weapons have fought, that model has fought. | When all models in a unit that are making melee attacks have resolved all of those attacks, that unit has fought. | If a unit was selected to fight and none of the models in it make any attacks, it has not fought."
04. Making Attacks,Resolve Attacks,04.03,accordion,04.03.06 - Finished Making Its Attacks,"When all of an attacking unit’s attacks have been resolved, it has finished making its attacks, and that unit has attacked."
Teams Event Companion,INTRODUCTION,,text,,"This companion is used alongside the Warhammer Event Companion to create the best experiences for all hobbyists playing a Teams Event. A Teams Event is one in which players compete in teams. Teams are matched against each other, with each member of a team fighting a battle against a member of the other team. | The recommendations are presented as follows: | Warhammer Teams Event Mission Sequence: Adjustments to the steps players would normally follow to generate a mission and prepare the battlefield. | Pairings and Rankings: Advice for fairly pairing players and determining rankings. | For all other recommendations – for example regarding errata and FAQs – please refer to the Warhammer Event Companion."
Teams Event Companion,WARHAMMER TEAMS EVENT MISSION SEQUENCE,,text,,"Before attending a Warhammer Teams Event, each team completes the following step:"
Teams Event Companion,1. TEAM COMPOSITION AND MUSTER ARMIES,,text,,"Each team should have a single captain who is responsible for ensuring that players submit lists on time, and that scores are submitted at the end of each round. Within each team, only one player can use units with a given faction keyword. This will normally mean that only one player can use units from each Codex, including as allied forces. This does not apply to cases where the ally rules being used change faction keywords, or where datasheets appear in multiple Codexes with different faction keywords (e.g. Chaos Daemons and Khorne Daemons in Codex: World Eaters ). Each player then musters an army as described in the Warhammer 40,000 app, with the following exception: once they have mustered their army, a player selects one Force Disposition card available to them and records that on their roster. Within each team, for every 5 players (rounding up), only one player can select each Force Disposition. Example: At a 5-player Teams Event, each player must have a different Force Disposition. Example: At an 8-player Teams Event, each Force Disposition must have been selected at least once by a different player; the remaining 3 players can then each select a 2nd instance of each Force Disposition. | A Warhammer Event battle is then waged by completing the remaining steps below (see next page)."
Teams Event Companion,2.  PAIRING SYSTEM,,text,,"In every round, each member of a team will play a game against one member of the opposing team, and the accumulated scores of all team members will decide the winner of a round. At the start of each round, both teams must follow the pairing system appropriate for the size of your teams. This determines which players from each team will play each other. Team captains are responsible for coordinating the pairing system. | Once the pairing system is complete, each player pair heads to their table to play. Each player finds their opponent’s Force Disposition symbol on their Force Disposition card. The Primary Mission that is listed below that symbol is that player’s Primary Mission, which describes how to score VP. The pairing system is broken down into 3 modules, with the size of your teams determining which modules you use, as follows: | 3-player Teams: Use Main Engagement. | 4-player Teams: Use Main Engagement and Champion System. | 5-player Teams: Use Initial Skirmish and Main Engagement. | 6-player Teams: Use Initial Skirmish, Main Engagement and Champion System. | 7-player Teams: Use Initial Skirmish twice and Main Engagement. | 8-player Teams: Use Initial Skirmish twice , Main Engagement and Champion System."
Teams Event Companion,INITIAL SKIRMISH,,text,,"Each team secretly selects one member to be their Defender. | Each team’s selected Defender is revealed simultaneously. | Each team now secretly selects two of their remaining members to be Attackers against the opposing Defender. | Each team’s selected Attackers are revealed simultaneously. | Each team now secretly chooses which of the two opposing Attackers they want their Defender to play against. | The chosen Attackers are revealed simultaneously. This decides two match-ups. | Each team’s Defender declares their layout choice. | Designer’s Note: Each combination of Primary Missions has three recommended layouts, labelled A, B and C. These can be found in the Warhammer 40,000 app and in the Warhammer Event Companion."
Teams Event Companion,MAIN ENGAGEMENT,,text,,"Each team secretly selects one member to be their Defender. | Each team’s selected Defender is revealed simultaneously. | Each team now secretly selects two of their remaining members to be Attackers against the opposing Defender. | Each team’s selected Attackers are revealed simultaneously. | Each team now secretly chooses which of the two opposing Attackers they want their Defender to play against. | The chosen Attackers are revealed simultaneously. This decides two matchups. | Each team’s Defender declares their layout choice. | The refused Attacker from each team plays against one another. These players will use a layout based on the round: in round 1 use Layout A, in round 2 use Layout B, and in round 3 use Layout C, repeating this cycle in further rounds."
Teams Event Companion,CHAMPION SYSTEM,,text,,"This will leave one player from each team, who becomes the Champion. These players will use a layout based on the round: in round 1 use Layout A, in round 2 use Layout B, and in round 3 use Layout C, repeating this cycle in further rounds."
Teams Event Companion,3. CREATE THE BATTLEFIELD,,text,,"Missions are played on rectangular battlefields 44"" by 60"" in size. Players set up the terrain areas as shown in the selected layout, then set up terrain features on those terrain areas as shown in the selected layout."
Teams Event Companion,4. DETERMINE ATTACKER AND DEFENDER,,text,,"Players look at the selected layout and agree which edges of the battlefield the players have set up correspond with the Attacker’s and Defender’s battlefield edges labelled on the card. Who is the Attacker and who is the Defender matches the pairings system. For refused Attackers or Champions playing each other, roll off: the winner decides who will be the Attacker and who will be the Defender for steps 5-8."
Teams Event Companion,5. SELECT SECONDARY MISSIONS,,text,,"Secondary Mission cards detail additional ways to score VP. Players now secretly note down whether they will use Tactical or Fixed Secondary Missions. If using Fixed Missions, they also note down which two Fixed Missions they will use (see below). Players then reveal these decisions."
Teams Event Companion,FIXED MISSIONS,,text,,"Fixed Missions are those marked with the symbol shown on the left. If you are using Fixed Missions, display your selected Fixed Mission cards face-up. Fixed Missions cannot be discarded and are active for you throughout the battle."
Teams Event Companion,TACTICAL MISSIONS,,text,,"If you are using Tactical Missions, shuffle your Secondary Mission deck face-down. | At the start of your Command phase, draw two Secondary Missions face-up from your Secondary Missions deck; these Secondary Missions are active for you. | (Once per battle) At the end of your Command phase, you can spend 1CP to discard one of your active Secondary Mission cards and draw one new Secondary Mission card."
Teams Event Companion,ACHIEVING SECONDARY MISSIONS,,text,,"At the end of each player’s turn, each player does the following, starting with the player whose turn it is: | First, if you met the conditions on one or more Secondary Missions, you can gain the VP specified on that card. If you do, and if you are using Tactical Secondary Missions, discard that Secondary Mission – it is achieved. | Then, if it is your turn and you are using Tactical Secondary Missions, you can discard one or more of your active Secondary Missions. If you do, you gain 1CP."
Teams Event Companion,6. DECLARE BATTLE FORMATIONS,,text,,"Players secretly note down, in order: | Which of their units will start the battle embarked within which TRANSPORTS . | Which of their units will start the battle in strategic reserves . | Players then reveal these decisions."
Teams Event Companion,7. DEPLOY ARMIES,,text,,"Players take it in turns to set up their units (excluding those in strategic reserves ) one at a time, wholly within their deployment zone, starting with the Defender. If you set up a TITANIC unit when it is your turn to set up a unit, skip your next turn to set up a unit. Once you have finished setting up your units, if your opponent has any units that have not been set up, they set up those units."
Teams Event Companion,8. REDEPLOY UNITS,,text,,"Some rules let you redeploy certain units after both armies are deployed. Unless otherwise stated, you resolve those rules in this step. Players alternate resolving any such rules, starting with the Attacker. Units placed in strategic reserves in this step do not count towards the combined points value of your strategic reserves units."
Teams Event Companion,9. DETERMINE FIRST TURN,,text,,Roll off: the winner takes the first turn.
Teams Event Companion,10. RESOLVE PRE-BATTLE RULES,,text,,"Players alternate resolving any pre-battle rules units from their army may have, starting with the player who will take the first turn."
Teams Event Companion,11. BEGIN THE BATTLE,,text,,The first battle round begins.
Teams Event Companion,12. END THE BATTLE,,text,,"The battle ends after five battle rounds have been completed. Even if you have no models remaining in your army at the start of your turn, players continue to play out their turns until the battle ends."
Teams Event Companion,13. DETERMINE VICTOR,,text,,"Each player scores 10VP if their army is painted to a Battle Ready standard. At the end of the battle, the player with the most VP is the victor. If the players are tied, the battle is a draw. The maximum VP that can be scored from each source of VP is listed below. Any VP you score in excess of these maximums are ignored. | VP SOURCE | MAXIMUM VP | PRIMARY MISSION | 45VP | Up to 15VP per battle round | SECONDARY MISSIONS | 45VP | Up to 15VP per battle round* | BATTLE READY ARMY | 10VP | * In addition, you can gain a maximum of 20VP per Fixed Secondary Mission card."
Teams Event Companion,14. TEAM SCORING,,text,,"After determining the victor, both players receive Battle Points (BP) that add to their team’s score based on the VP they scored during the game. | Each player scores an amount of BP for their team based on the VP differential from their individual game. To determine BP, each player counts their VP, subtracts their opponent’s VP and consults the table below. If the VP differential is negative, the player with the negative difference counts their BP score from the ‘Opponent’ table. | Designer's Note: The BP total if you add both players’ BP together should always equal 20. | VP DIFFERENCE | PLAYER BATTLE POINTS | OPPONENT BATTLE POINTS | 0-5 | 10 | 10 | 6-10 | 11 | 9 | 11-15 | 12 | 8 | 16-20 | 13 | 7 | 21-25 | 14 | 6 | 26-30 | 15 | 5 | 31-35 | 16 | 4 | 36-40 | 17 | 3 | 41-45 | 18 | 2 | 46-50 | 19 | 1 | 51+ | 20 | 0 | Example: The final score of a game is 86-54, with player A scoring 86VP and player B scoring 54VP. The VP differential is 32 for player A and -32 for player B. This means player A scores 16BP for their team, while player B scores 4BP for theirs. | At the end of the round, each team’s total BP score is added up, and a match winner is determined. A team’s total BP score must exceed their opponents' by at least Y BP to score a win (Where Y matches the table below) – any smaller margin results in a draw. | TEAM SIZE | DIFFERENTIAL | 3-player teams | 4 | 4-player teams | 6 | 5-player teams | 6 | 6-player teams | 8 | 7-player teams | 10 | 8-player teams | 12 | Example: At a 5-player Teams Event, at the end of the round, Team A scored 54BP and Team B scored 46BP. As the difference is at least 6BP, Team A is the winner. | The match-winning team scores 3 Team Points (TP), with the losing team scoring 1TP. In the case of a draw, both teams score 2TP."
Teams Event Companion,‘CUMULATIVE’ AND ‘OR’ CONDITIONS,,text,,"Some cards include a condition marked as ‘cumulative’ that follows a normal condition. If a player achieves the cumulative condition, they gain the VP for both that and the normal condition. | Some cards include one or more conditions marked ‘or’ that follow a normal condition. A player can only gain VP for one of these conditions or the normal condition."
Teams Event Companion,LEAVES THE BATTELEFIELD,,text,,"Some cards refer to a unit or units leaving the battlefield. A unit leaves the battlefield if it is destroyed, if it embarks on a TRANSPORT , or if a rule removes that unit from the battlefield (e.g. to place it in strategic reserves )."
Teams Event Companion,ONE,,text,,"When a card states ‘one’, underlined, it means exactly one, not one or more."
Teams Event Companion,VP UP TO A LIMIT,,text,,"Some cards award VP up to a limit, e.g. (up to 5VP). In such cases, any VP you score in excess of this limit are ignored."
Teams Event Companion,WHEN DRAWN,,text,,Some Secondary Mission cards begin with a ‘When Drawn’ section. Note that this section only applies if you are using Tactical Secondary Missions.
Teams Event Companion,PAIRINGS AND RANKINGS,,text,,"There are countless different ways in which a Warhammer organised play event can be run. While broad-stroke concepts like pairing off teams with the same record are straightforward enough, the nuance of running a successful Warhammer tournament is the subject of continuous conversation and evolution. The following recommendations are once again for newer organisers who are still establishing their principles and best practices, to help improve the average experience at any Warhammer tournament. These principles are also followed at most official Games Workshop events, and are designed to create the fairest, most fun experience possible for every attendee, regardless of standing."
Teams Event Companion,PAIRING TEAMS,,text,,"While the first round of most tournaments is randomly paired, subsequent round pairing can be done in a number of ways. The first pairing metric will almost always be team record, i.e. pairing a 3-1 team with another 3-1 team, and so on. Given that most rounds will include numerous teams with the same record, however, deciding pairings beyond this metric can be quite nuanced, and the different methods available can have significant impacts on the experience of players at an event. We recommend pairing teams by the following criteria: | First – by Team Points (i.e. the number of wins, losses and draws) | Second – by total number of individual wins (i.e. the cumulative of all individual wins scored by every team member in each round so far) | Third – randomly within players of the same ranking"
Teams Event Companion,TEAM RANKINGS,,text,,"In many tournaments, the overall Best Team will be the single remaining undefeated team at the end of the event. Sometimes, however, due to draws between teams or the number of rounds, this will not be determined, and teams often wish to know their ranking regardless of whether they won the whole event. To help break ties between teams who end an event with the same record, we recommend ranking teams by the following criteria: | First – by record (i.e. the number of wins, losses and draws) | Second – by total number of individual wins (i.e. the cumulative of all individual wins scored by every team member in each round) | Third – by total Battle Points (i.e. the cumulative of all BP scored by every team member in each round)"
Appendix,Cumulative' and 'Or' Conditions,,text,,"Some cards include a condition marked as ‘cumulative’ that follows a normal condition. If a player achieves the cumulative condition, they gain the VP for both that and the normal condition. | Some cards include one or more conditions marked ‘or’ that follow a normal condition. A player can only gain VP for one of these conditions or the normal condition."
Appendix,Leaves the Battlefield,,text,,"Some cards refer to a unit or units leaving the battlefield. A unit leaves the battlefield if it is **destroyed**, if it embarks on a **TRANSPORT**, or if a rule removes that unit from the battlefield (e.g. to place it in **strategic reserves**)."
Appendix,One,,text,,"When a card states ‘one’, underlined, it means exactly one, not one or more."
Appendix,VP Up To a Limit,,text,,"Some cards award VP up to a limit, e.g. (up to 5VP). In such cases, any VP you score in excess of this limit are ignored."
Appendix,When Drawn,,text,,Some Secondary Mission cards begin with a ‘When Drawn’ section. Note that this section only applies if you are using Tactical Secondary Missions.
Dominatus Event Companion,INTRODUCTION,,text,,"Welcome to the Warhammer Dominatus Event Companion! This document is designed to help you run and play in an organised Dominatus event. It uses the Dominatus deck and the most recent Chapter Approved Mission Deck to create the best experiences for all hobbyists. | The recommendations are presented as follows: | Warhammer Dominatus Event Guidance: Recommendations on how to adapt the Dominatus deck for an organised event. | Warhammer Dominatus Event Mission Sequence: Adjustments to the steps players would normally follow to generate a mission and prepare the battlefield. | Pairings: Advice for fairly pairing players. | Designer’s Note: This companion is used alongside the Warhammer Event Companion, which includes guidance on the best use of the Chapter Approved Mission Deck in a Warhammer Event, as well as recommended layouts. This can be found on warhammer-community.com."
Dominatus Event Companion,WARHAMMER DOMINATUS EVENT GUIDANCE,,text,,"A Warhammer Dominatus Event uses the rules in the Dominatus deck, with the following recommendations:"
Dominatus Event Companion,RESOURCES,,text,,Each player must have a Dominatus deck.
Dominatus Event Companion,WARMASTER,,text,,"The Warhammer Event organiser is the Warmaster . | At the start of each campaign phase, the Warmaster can select that phase’s Location card, instead of rolling. | The Warmaster can require a player to change their Alliance (see Muster Armies, below)."
Dominatus Event Companion,CHANGES TO THE END OF CAMPAIGN PHASE,,text,,"The Acquire Relics step and the Discard step at the end of each campaign phase are resolved at the Determine Mission step of the first battle in the next campaign phase, instead of as described in the Dominatus deck. | The Fresh Supplies and Test of Mettle location bonuses are resolved at the Determine Mission step of the first battle in the next campaign phase, instead of as described in the Dominatus deck. | The Auspicious Augury location bonus is resolved as described in the Dominatus deck, but we recommend that each player does so in the presence of a player from another Alliance."
Dominatus Event Companion,WARHAMMER DOMINATUS EVENT MISSION SEQUENCE,,text,,"Before attending a Warhammer Dominatus Event, each player completes the following step:"
Dominatus Event Companion,1. MUSTER ARMIES,,text,,"Muster armies as described in the Warhammer 40,000 app, with the following exception: once they have mustered their army, a player selects one Force Disposition card available to them and one Alliance as described in the Dominatus deck, and records those on their roster. | A Warhammer Dominatus Event battle is then waged by completing the remaining steps below:"
Dominatus Event Companion,2.  DETERMINE MISSION,,text,,"Read aloud all war zone rules for that phase from your Location card – these apply to the upcoming battle. | If both players wish to attempt Agendas in the battle (if not, see Declining Agendas below), do not use the Primary Missions in your mission deck. Instead, after revealing Force Disposition cards, the players use their Alliance’s current Briefing card and use the chart on it to compare their selected Force Disposition with that of their opponent. This combination will result in a specific Agenda card, which will state the Primary Mission to use in this battle. | Designer’s Note: Whether players wish to attempt Agendas or not, the players’ Force Disposition cards are used to determine a layout, as described below. | DECLINING AGENDAS | If one or both players decline to attempt Agendas in a battle, determine Primary Missions by comparing Force Disposition cards. Each player finds their opponent’s Force Disposition symbol on their Force Disposition card. The Primary Mission that is listed below that symbol is that player’s Primary Mission, which describes how to score VP. Only a player that declined to attempt Agendas can score VP from that Primary Mission. A player that opted to attempt an Agenda cannot score VP from that Primary Mission and instead they use the Primary Mission on their Agenda card."
Dominatus Event Companion,3. DETERMINE A LAYOUT,,text,,"Each combination of Primary Missions has three recommended layouts, labelled A, B and C. These can be found in the Warhammer 40,000 app and in the Warhammer Event Companion. As directed by the Warmaster , the players either use the layout specified or randomly determine which of these layouts to use."
Dominatus Event Companion,4. CREATE THE BATTLEFIELD,,text,,"Missions are played on rectangular battlefields 44"" by 60"" in size. Players set up the terrain areas as shown in the selected layout, then set up terrain features on those terrain areas as shown in the selected layout."
Dominatus Event Companion,5. DETERMINE ATTACKER AND DEFENDER,,text,,Players look at the selected layout and agree which edges of the battlefield the players have set up correspond with the Attacker’s and Defender’s battlefield edges labelled on the card. Roll off: the winner decides who will be the Attacker and who will be the Defender.
Dominatus Event Companion,6. SELECT SECONDARY MISSIONS,,text,,"Secondary Mission cards detail additional ways to score VP. Players now secretly note down whether they will use Tactical or Fixed Secondary Missions. If using Fixed Missions, they also note down which two Fixed Missions they will use (see below). Players then reveal these decisions."
Dominatus Event Companion,FIXED MISSIONS,,text,,"Fixed Missions are those marked with the symbol shown on the left. If you are using Fixed Missions, display your selected Fixed Mission cards face-up. Fixed Missions cannot be discarded and are active for you throughout the battle."
Dominatus Event Companion,TACTICAL MISSIONS,,text,,"If you are using Tactical Missions, shuffle your Secondary Mission deck face-down. | At the start of your Command phase, draw two Secondary Missions face-up from your Secondary Missions deck; these Secondary Missions are active for you. | (Once per battle) At the end of your Command phase, you can spend 1CP to discard one of your active Secondary Mission cards and draw one new Secondary Mission card."
Dominatus Event Companion,ACHIEVING SECONDARY MISSIONS,,text,,"At the end of each player’s turn, each player does the following, starting with the player whose turn it is: | First, if you met the conditions on one or more Secondary Missions, you can gain the VP specified on that card. If you do, and if you are using Tactical Secondary Missions, discard that Secondary Mission – it is achieved. | Then, if it is your turn and you are using Tactical Secondary Missions, you can discard one or more of your active Secondary Missions. If you do, you gain 1CP."
Dominatus Event Companion,7. DECLARE BATTLE FORMATIONS,,text,,"Players secretly note down, in order: | Up to 3 Upgrade cards they have earned during the campaign, and which friendly unit each of those Upgrade cards is given to until the end of the battle (a unit cannot have more than one Upgrade card). | Which of their units will start the battle embarked within which TRANSPORTS . | Which of their units will start the battle in strategic reserves . | Players then reveal these decisions."
Dominatus Event Companion,8. DEPLOY ARMIES,,text,,"Players take it in turns to set up their units (excluding those in strategic reserves ) one at a time, wholly within their deployment zone, starting with the Defender. If you set up a TITANIC unit when it is your turn to set up a unit, skip your next turn to set up a unit. Once you have finished setting up your units, if your opponent has any units that have not been set up, they set up those units."
